"text","direction"
"项目延期我们加班赶工","left"
"The alarm triggered and security arrived within minutes","left"
"会议结束大家各自返岗","left"
"数据库崩溃运维紧急重启","left"
"She submitted the form then waited for approval","left"
"快递到了我马上去取","left"
"Traffic cleared so we accelerated","left"
"样品检测完毕实验继续推进","left"
"He clicked save and closed the tab","left"
"温度达标产线开始运转","left"
"The test passed deployment proceeded","left"
"客户投诉处理完毕工单关闭","left"
"备份完成服务器可以重启","left"
"Code reviewed merge approved","left"
"文件上传成功开始解析","left"
"Signal lost reconnection initiated","left"
"预算批准采购立即启动","left"
"Payment confirmed order shipped","left"
"审核通过证书即刻发放","left"
"The scan finished results displayed","left"
"传感器报警工程师赶赴现场","left"
"Library closed students left campus","left"
"订单生成系统自动扣款","left"
"Backup failed admin notified","left"
"考试结束试卷统一上交","left"
"Fire drill started everyone evacuated","left"
"密码错误账号被锁定","left"
"Container crashed orchestrator restarted it","left"
"门禁刷卡记录同步上传","left"
"Inspection done certificate issued","left"
"疫苗接种完护士登记信息","left"
"The wire snapped circuit breaker tripped","left"
"客流量激增商场增派保安","left"
"Quota exceeded requests throttled","left"
"比赛结束裁判宣布成绩","left"
"Sensor malfunction production halted","left"
"油箱见底司机找加油站","left"
"Authentication succeeded token generated","left"
"库存不足系统触发补货流程","left"
"Power outage backup generator activated","left"
"处方开好患者去药房取药","left"
"Download complete installation began","left"
"抵押物评估完贷款进入审批","left"
"Schema migrated application redeployed","left"
"红灯亮起车辆依次停下","left"
"Certificate expired renewal triggered","left"
"航班延误旅客改签其他班次","left"
"Build succeeded artifacts uploaded","left"
"课程结课学生提交作业","left"
"The valve opened fluid started flowing","left"
"合同签署款项按期到账","left"
"Rollback initiated previous version restored","left"
"检查点通过车辆继续前行","left"
"Timeout reached connection dropped","left"
"试用期满员工转正手续办理","left"
"Calibration completed measurements resumed","left"
"押金退还租赁关系终止","left"
"Alert acknowledged on-call engineer paged","left"
"货物清点无误签收确认","left"
"Sync finished local cache updated","left"
"保修到期续保流程启动","left"
"Config changed services reloaded","left"
"体检报告出炉医生解读结果","left"
"Threshold breached scaling triggered","left"
"预约时间到患者进入诊室","left"
"Job finished worker returned to pool","left"
"积分累积足够兑换开始","left"
"Healthcheck failed instance removed","left"
"培训完成证书打印发放","left"
"Query timed out fallback executed","left"
"所有人离场保安锁门","left"
"Rate limit hit response delayed","left"
"Everyone was confused — turns out the announcement was mistranslated","right"
"系统看似正常直到日志显示内存泄漏","right"
"The project seemed on track until the audit revealed discrepancies","right"
"她突然笑了原来是收到好消息","right"
"Nobody understood why — later we learned the protocol had changed","right"
"指标一度平稳后来发现是监控失效","right"
"It looked like a success but the rollback told another story","right"
"团队很乐观实则隐患早已埋下","right"
"The dashboard showed green metrics until someone checked raw data","right"
"客户满意度高企背后是投诉被过滤","right"
"Everyone thought it was fixed — the real cause surfaced weeks later","right"
"数据库响应快速实际上是缓存掩盖了问题","right"
"The deployment went smoothly or so we thought before errors flooded in","right"
"他表现淡定后文才知内心早已崩溃","right"
"Sales figures looked impressive until the refund rate was factored in","right"
"系统声称高可用直到单点故障暴露","right"
"The experiment appeared successful but peer review found fatal flaws","right"
"大家以为危机解除实则只是暂时平息","right"
"Performance metrics soared — nobody noticed the test data was cached","right"
"领导很满意后来审计发现数据造假","right"
"The alert was dismissed as noise until the outage hit","right"
"表面风平浪静内部早已矛盾重重","right"
"Initial tests passed final validation revealed regressions","right"
"他们声称无风险事后证明预警被忽略","right"
"The model showed high accuracy — only later did bias emerge","right"
"运维报告一切正常用户却频繁掉线","right"
"Everyone celebrated the launch until scalability issues surfaced","right"
"看起来是网络问题根因是配置错误","right"
"The backup was verified — restoration exposed corruption","right"
"她的解释很合理直到证据推翻了说法","right"
"Logs showed no errors but users reported widespread failures","right"
"团队士气高涨直到裁员消息传出","right"
"The API responded normally until traffic doubled and it collapsed","right"
"初步诊断是感冒深入检查才发现是过敏","right"
"Security audit passed later a breach was traced back months","right"
"数据显示增长实际是统计口径调整","right"
"The feature worked in staging production told a different story","right"
"他声称已修复复现时问题依旧","right"
"Tests all green deployment revealed edge cases nobody anticipated","right"
"看似简单的需求实现时才知架构限制","right"
"The contract looked favorable hidden clauses were problematic","right"
"反馈说体验好实则是样本选择偏差","right"
"Code review found nothing runtime exposed memory leaks","right"
"预算看上去充足执行中才发现缺口","right"
"The sensor reading was stable malfunction was intermittent","right"
"用户说满意深挖才知是无奈妥协","right"
"Monitoring showed stability the real issue was silent data loss","right"
"原以为是小改动重构后才知牵一发动全身","right"
"The explanation made sense until contradictory evidence appeared","right"
"表现符合预期压测暴露瓶颈","right"
"Everyone assumed compatibility actual integration broke silently","right"
"他说没问题后续才发现理解有误","right"
"The migration seemed complete orphaned records were discovered later","right"
"初看是用户操作失误追踪发现是界面误导","right"
"Confidence was high reality check came with customer complaints","right"
"数据一致性良好直到跨区同步失败","right"
"The plan was approved execution revealed unforeseen dependencies","right"
"声称已优化实测性能反而下降","right"
"Documentation said it was supported actual behavior differed","right"
"他表示理解后续行动证明没懂","right"
"The workaround functioned — root cause remained unaddressed","right"
"指标达标了但用户体验变差了","right"
"Ticket closed prematurely issue resurfaced immediately","right"
"虽然代码量增加但可维护性提升","bidirectional"
"Not only did latency drop but throughput also improved","bidirectional"
"一方面成本上升另一方面质量提高","bidirectional"
"The system is fast yet unreliable","bidirectional"
"既要保证速度又要确保准确","bidirectional"
"Revenue grew however profit margins shrank","bidirectional"
"前端优化了后端却成为瓶颈","bidirectional"
"She excels at coding but struggles with communication","bidirectional"
"尽管流程简化了培训成本反而增加","bidirectional"
"CPU usage decreased while memory consumption spiked","bidirectional"
"团队扩张了协作效率却下降了","bidirectional"
"The feature is powerful yet complex to configure","bidirectional"
"虽然自动化了但仍需人工干预","bidirectional"
"Requests increased but error rates remained stable","bidirectional"
"产品迭代快用户反馈跟不上","bidirectional"
"The design is elegant however implementation is messy","bidirectional"
"一边裁员一边招聘","bidirectional"
"Security tightened but usability suffered","bidirectional"
"既有创新也有风险","bidirectional"
"Sales peaked yet inventory piled up","bidirectional"
"响应变快了但资源消耗更高","bidirectional"
"The platform scales well but costs escalate","bidirectional"
"文档详尽可读性较差","bidirectional"
"Coverage expanded while depth reduced","bidirectional"
"既要快速交付又要质量保障","bidirectional"
"The API is flexible but hard to debug","bidirectional"
"流量增长了收入却没涨","bidirectional"
"Training improved yet turnover increased","bidirectional"
"架构解耦了运维复杂度上升","bidirectional"
"The UI modernized but learning curve steepened","bidirectional"
"客户满意度高投诉量也不低","bidirectional"
"Data volume grew processing time stayed constant","bidirectional"
"既保留传统又拥抱变革","bidirectional"
"The tool automates tasks but requires setup","bidirectional"
"市场份额扩大利润率缩小","bidirectional"
"Availability increased recovery time worsened","bidirectional"
"产品线拓宽了核心业务被稀释","bidirectional"
"The policy is fair yet unpopular","bidirectional"
"虽然节省人力但增加了技术债","bidirectional"
"Incidents decreased but severity intensified","bidirectional"
"团队多元化了决策时间拉长","bidirectional"
"The algorithm is accurate but computationally expensive","bidirectional"
"既追求创新又规避风险","bidirectional"
"Load balanced yet bottlenecks persist","bidirectional"
"服务上云了迁移成本巨大","bidirectional"
"The process streamlined however exceptions multiplied","bidirectional"
"功能丰富了性能下降了","bidirectional"
"Visibility improved while overhead grew","bidirectional"
"既要降本又要增效","bidirectional"
"The strategy pivoted but momentum was lost","bidirectional"
"用户增长了活跃度降低","bidirectional"
"Modularity enhanced debugging complicated","bidirectional"
"既有机遇也有挑战","bidirectional"
"The network upgraded yet congestion remained","bidirectional"
"研发投入加大回报周期延长","bidirectional"
"Compliance improved but agility decreased","bidirectional"
"产品差异化了市场教育成本高","bidirectional"
"The dashboard is comprehensive yet overwhelming","bidirectional"
"权限收紧了协作变困难","bidirectional"
"Adoption soared while satisfaction dropped","bidirectional"
"火灾警报响起楼内人员疏散","left"
"系统负载飙升自动扩容触发","left"
"The patient recovered and was discharged","left"
"快递签收消息推送到手机","left"
"Credentials rotated services restarted","left"
"比分落后教练换人调整","left"
"Schema updated migrations applied","left"
"电量耗尽设备自动关机","left"
"The event ended attendees dispersed","left"
"订单取消退款原路返回","left"
"License renewed access restored","left"
"传感器数据异常系统发出告警","left"
"The wire connected signal transmitted","left"
"需求变更开发重新排期","left"
"Certificate installed SSL enabled","left"
"库存盘点完毕差异上报","left"
"Heartbeat missed failover initiated","left"
"考勤打卡记录同步至HR系统","left"
"The timer expired session terminated","left"
"密钥泄露紧急撤销权限","left"
"Batch processed results exported","left"
"运输途中货物受损保险理赔启动","left"
"The queue filled consumers scaled out","left"
"验证码过期用户重新获取","left"
"Workflow completed notification sent","left"
"试剂耗尽实验暂停补充","left"
"The bridge collapsed traffic rerouted","left"
"租约到期自动续费扣款","left"
"Policy violated account suspended","left"
"Did the server really crash or was it just restarted","right"
"为何突然静默原来是权限被收回","right"
"Was it a bug or just user error","right"
"指标为何骤降后台才知是采集中断","right"
"The team was confident — overconfidence led to oversight","right"
"他说已解决实际只是规避了表象","right"
"Did they approve it or merely acknowledge receipt","right"
"系统响应慢最终定位是第三方依赖","right"
"The feature worked initially only scale exposed the flaw","right"
"大家认为是硬件问题软件bug才是元凶","right"
"Was the outage brief or did monitoring just miss it","right"
"看似随机的故障模式分析揭示了周期性","right"
"The migration succeeded — data integrity was compromised","right"
"反馈称满意深究后是期望本就不高","right"
"Did performance improve or did workload just decrease","right"
"告警静默了以为修好实则是监控失效","right"
"The API returned success but side effects were ignored","right"
"一切看似正常异步任务全失败了","right"
"Was it optimized or just moved to off-peak hours","right"
"测试全过上线就挂是环境差异惹的祸","right"
"The report looked clean until someone checked the source","right"
"他说会处理后续发现理解偏差巨大","right"
"Did they fix the root cause or just add a retry","right"
"业务增长了利润下滑是成本失控","right"
"The dashboard was green but alerts were disabled","right"
"表面合规深入审查发现漏洞","right"
"Was the latency reduced or just the timeout increased","right"
"虽然指标优化但降低了准确性","bidirectional"
"The service is cheap but support is lacking","bidirectional"
"既降低延迟又增加吞吐","bidirectional"
"Load spiked but capacity held firm","bidirectional"
"一边加密保护一边影响性能","bidirectional"
"The rollout was gradual yet disruptive","bidirectional"
"既要用户体验又要数据安全","bidirectional"
"Redundancy increased but complexity followed","bidirectional"
"功能删减了系统反而更稳定","bidirectional"
"The codebase shrunk while maintainability improved","bidirectional"
"既节约资源又保证服务质量","bidirectional"
"Automation reduced errors but increased dependency","bidirectional"
"团队分布式协作成本增加","bidirectional"
"The interface simplified but capabilities diminished","bidirectional"
"既要兼容老版本又要推进新特性","bidirectional"
"Monitoring expanded yet visibility decreased","bidirectional"
"频率提高了单次时长缩短","bidirectional"
"The architecture is modern but migration is risky","bidirectional"
"既有标准化又有定制化","bidirectional"
"Decoupling succeeded but overhead emerged","bidirectional"
"服务拆分了依赖关系更复杂","bidirectional"
"The process is transparent yet bureaucratic","bidirectional"
"既要敏捷迭代又要稳定运行","bidirectional"
"Quality improved while velocity slowed","bidirectional"
"产能扩大了单位成本攀升","bidirectional"
"The system is robust but inflexible","bidirectional"
"既提升自动化又保留人工审核","bidirectional"
"Coverage broadened but precision dropped","bidirectional"
"咖啡到手我就开写","left"
"表单点了发送，群里立马安静了","left"
"门卡刷一下，门就开了","left"
"灯一灭，我们就收工","left"
"截图发过去，我这边就回滚了","left"
"需求拍板，马上拉群","left"
"打包一完，直接提审","left"
"快递一取，顺手退群","left"
"测试喊过线，我这边立刻上线","left"
"铃一响，大家坐好","left"
"表格拖进来，后台就开始算","left"
"文档改好，随后提给老板","left"
"构建通过，脚本就开跑","left"
"卡号一核验，支付就过了","left"
"Ping first, fix later","left"
"Save, push, ship.","left"
"Build passed, just ship it","left"
"Backup done, roll it out","left"
"Click, confirm, done.","left"
"Ready? Deploy.","left"
"看着挺稳的，结果监控是静音","right"
"都说没问题，后来才知道少了权限","right"
"以为他生气了，其实是掉线了","right"
"页面一直绿灯，事后才发现探针挂了","right"
"我还在夸快，结果客服那边说工单卡在审批","right"
"群里一直没人说话，才发现通知被关了","right"
"他没回我，翻日志才知道在重启","right"
"感觉不卡，回头看丢包爆表","right"
"OK是OK，后来发现用的是测试库","right"
"现场挺顺，晚点才知道路线临时改了","right"
"Seemed fine — the canary was off","right"
"Numbers looked great; turns out half the data was missing","right"
"All good… until the audit notes dropped","right"
"Looks green; the alerts were muted","right"
"Ship looked smooth — staging creds in prod","right"
"Passed on my laptop — env var missing in prod","right"
"快点搞，但别搞坏","bidirectional"
"能省就省，可体验别掉","bidirectional"
"你说急，我说稳","bidirectional"
"上量要快，下线要稳","bidirectional"
"多发版本？少出问题。两头都要顾","bidirectional"
"少讲故事，多给证据","bidirectional"
"省钱可以，服务别缩水","bidirectional"
"跑得快也要看路","bidirectional"
"指标好看，体验也得好看","bidirectional"
"交付要冲，回滚要顺","bidirectional"
"Not more features, just better ones","bidirectional"
"Push hard, sleep enough","bidirectional"
"Less alerts, same coverage","bidirectional"
"Ship faster, break nothing","bidirectional"
"Cut costs, keep quality","bidirectional"
"Move quick, review slower","bidirectional"
"省步骤不省质量","bidirectional"
"稳定要守，速度也要拉","bidirectional"
"业务要扩，成本也得收","bidirectional"
"敢上新，也要能兜底","bidirectional"
