"text","direction"
"数据新鲜，但历史不完整。","bidirectional"
"她答应帮忙，可还是提醒保密。","bidirectional"
"The fix is simple, yet the root cause is complex.","bidirectional"
"The plan is ambitious, but the budget is modest.","bidirectional"
"Performance improved; however, energy usage rose.","bidirectional"
"The docs are detailed, yet examples are scarce.","bidirectional"
"The offer is fair, but the terms are strict.","bidirectional"
"The chart looks smooth; however, it hides spikes.","bidirectional"
"The launch is near, yet dependencies slip.","bidirectional"
"The vote passed, but morale is mixed.","bidirectional"
"The cache is warm; however, eviction is aggressive.","bidirectional"
"The policy is clear, yet enforcement is weak.","bidirectional"
"他完成了实验，而且及时归档了数据。","left"
"清单已复核，同时补充了缺失项。","left"
"她写完脚本，并且提交了合并请求。","left"
"设备通电，而且风扇启动正常。","left"
"我们对齐需求，同时更新了里程碑。","left"
"他校对论文，并且修正了参考文献格式。","left"
"样本采集完成，而且标签一致性通过复检。","left"
"会议邀请已发，同时附上议程草案。","left"
"日志打点补齐，并且回放验证通过。","left"
"他整理行李，而且提前到达候车厅。","left"
"代码通过审查，同时补充了单元测试。","left"
"他完成拉练，并且汇报了复盘心得。","left"
"接口下线告知已出，而且灰度方案就绪。","left"
"她备份了相册，同时清理了重复照片。","left"
"设备贴上编号，并且登记到资产系统。","left"
"他结束夜班，而且把交接写清楚了。","left"
"版本号提升，同时更新了变更记录。","left"
"他测完电压，并且记录了温升曲线。","left"
"数据脱敏完成，而且通过了合规审查。","left"
"她设好闹钟，同时把手机充上电。","left"
"He finished the draft and then pushed to the repo.","left"
"She brewed coffee and started the standup.","left"
"Logs were rotated and archived to cold storage.","left"
"We compiled assets and deployed to staging.","left"
"He cleaned the dataset and retrained the model.","left"
"She watered the plants and opened the blinds.","left"
"They packed the kits and shipped them out.","left"
"We merged main and tagged the release.","left"
"She scanned receipts and filed the taxes.","left"
"He tightened screws and sealed the case.","left"
"他关掉电源，然后更换了保险丝。","left"
"雨停了，接着我们出发。","left"
"程序安装完成，随后进行了重启。","left"
"她读完协议，然后点击了同意。","left"
"机器预热完成，接着开始批量打印。","left"
"地图下载完毕，随后切到离线模式。","left"
"体检结束，接着回医院取报告。","left"
"他贴好标签，然后放入冷藏。","left"
"门铃响了，随后保安来核验身份。","left"
"她换上跑鞋，然后出了门。","left"
"我们锁定需求，而且标注了优先级。","left"
"巡检完成，同时同步到群里。","left"
"他加密文件，并且上传到网盘。","left"
"清洁工清扫走廊，而且拖干了地面。","left"
"他检查轮胎，同时补了胎压。","left"
"镜头校准完成，并且更新了标定表。","left"
"我们评审脚本，而且落实了负责人。","left"
"她合上电脑，同时拔掉电源。","left"
"他核对库存，并且下了补货单。","left"
"指标看板更新，而且新增了告警阈值。","left"
"We set the cron and verified the job ran.","left"
"She keyed the invoice and sent the receipt.","left"
"They staged the data and launched the query.","left"
"He tuned batch size and resumed training.","left"
"We warmed the cache and started the test.","left"
"She labeled issues and pinged reviewers.","left"
"He queued tasks and drained the backlog.","left"
"We pruned branches and re-seeded CI.","left"
"She synced notes and booked the room.","left"
"He zipped logs and opened a ticket.","left"
"她拧紧水龙头，而且关了总阀。","left"
"流程跑通，同时补足了边界用例。","left"
"记录整理完成，并且上传到知识库。","left"
"他确认指纹，而且激活了门禁。","left"
"包裹打包好，同时打印了面单。","left"
"她擦干杯子，并且摆回了架子。","left"
"脚本跑完，而且生成了对账表。","left"
"他核验人脸，同时登记到访时间。","left"
"量表发放完成，并且统计了回收率。","left"
"检查结束，而且贴上了合格标签。","left"
"她导出报表，并且发送到订阅邮箱。","left"
"他重置密码，同时保存到密码库。","left"
"我们锁定备选方案，并且安排了评测。","left"
"她换上新滤芯，同时清空了旧耗材。","left"
"他完成热身，并且开始计时跑。","left"
"工单关闭，而且附上了复盘链接。","left"
"我们补上封面，同时更新了目录。","left"
"她备齐材料，并且预约了窗口。","left"
"他贴上封条，同时拍照存档。","left"
"指令校验通过，并且下发到边缘节点。","left"
"He saved the draft and scheduled the post.","left"
"We pinned versions and rebuilt images.","left"
"She backed up configs and restarted services.","left"
"They notarized docs and filed the forms.","left"
"He mapped ports and opened the firewall.","left"
"We sanitized inputs and re-ran tests.","left"
"She staged photos and published the gallery.","left"
"He sorted mail and flagged urgent items.","left"
"We muted alerts and began maintenance.","left"
"She closed tabs and locked the screen.","left"
